{"$schema":"https://json-schema.org/draft/2020-12/schema","type":"object","required":["schema_version","catalog_id","rules_file","profiles"],"properties":{"schema_version":{"const":1},"catalog_id":{"type":"string","minLength":1},"rules_file":{"type":"string","pattern":"^[^/]"},"profiles":{"type":"array","items":{"type":"object","required":["profile_id","kind","document","definition"],"properties":{"profile_id":{"type":"string","pattern":"^[a-z0-9]+(?:-[a-z0-9]+)*$"},"kind":{"enum":["project"]},"document":{"type":"string","pattern":"^[^/]"},"definition":{"type":"string","pattern":"^[^/]"}},"additionalProperties":false}}},"additionalProperties":false}
